url;title;category;stars;price;in_stock;qty_in_stock
/better-homes-and-gardens-new-cook-book_423/index.html;Better Homes and Gardens New Cook Book;Food and Drink;3;39.61;True;6
/the-demon-prince-of-momochi-house-vol-4-the-demon-prince-of-momochi-house-4_344/index.html;The Demon Prince of Momochi House, Vol. 4 (The Demon Prince of Momochi House #4);Sequential Art;2;27.88;True;4
/shrunken-treasures-literary-classics-short-sweet-and-silly_484/index.html;Shrunken Treasures: Literary Classics, Short, Sweet, and Silly;Childrens;3;52.87;True;7
/the-firm_404/index.html;The Firm;Fiction;3;45.56;True;5
/whered-you-go-bernadette_304/index.html;Where'd You Go, Bernadette;Default;1;18.13;True;3
/an-unquiet-mind-a-memoir-of-moods-and-madness_422/index.html;An Unquiet Mind: A Memoir of Moods and Madness;Psychology;3;21.30;True;6
/the-bone-hunters-lexy-vaughan-steven-macaulay-2_343/index.html;The Bone Hunters (Lexy Vaughan & Steven Macaulay #2);Thriller;3;59.71;True;4
/rich-dad-poor-dad_483/index.html;Rich Dad, Poor Dad;Business;1;51.74;True;7
/the-fault-in-our-stars_403/index.html;The Fault in Our Stars;Default;1;47.22;True;5
/when-you-are-engulfed-in-flames_303/index.html;When You Are Engulfed in Flames;Humor;5;30.89;True;3
/a-year-in-provence-provence-1_421/index.html;A Year in Provence (Provence #1);Travel;4;56.88;True;6
/the-beast-black-dagger-brotherhood-14_342/index.html;The Beast (Black Dagger Brotherhood #14);Fantasy;5;46.08;True;4
/raymie-nightingale_482/index.html;Raymie Nightingale;Childrens;2;34.41;True;7
/we-the-people-the-modern-day-figures-who-have-reshaped-and-affirmed-the-founding-fathers-vision-of-america_302/index.html;We the People: The Modern-Day Figures Who Have Reshaped and Affirmed the Founding Fathers' Vision of America;Nonfiction;3;31.95;True;3
/the-false-prince-the-ascendance-trilogy-1_402/index.html;The False Prince (The Ascendance Trilogy #1);Fantasy;5;56.00;True;5
/shopaholic-ties-the-knot-shopaholic-3_340/index.html;Shopaholic Ties the Knot (Shopaholic #3);Womens Fiction;5;48.39;True;4
/some-women_341/index.html;Some Women;Womens Fiction;5;13.73;True;4
/we-are-all-completely-beside-ourselves_301/index.html;We Are All Completely Beside Ourselves;Contemporary;1;24.04;True;3
/playing-from-the-heart_481/index.html;Playing from the Heart;Childrens;1;32.38;True;7
/the-expatriates_401/index.html;The Expatriates;Fiction;2;44.58;True;5
/paper-and-fire-the-great-library-2_339/index.html;Paper and Fire (The Great Library #2);Fantasy;5;49.45;True;4
/outlander-outlander-1_338/index.html;Outlander (Outlander #1);Default;5;19.67;True;4
/orchestra-of-exiles-the-story-of-bronislaw-huberman-the-israel-philharmonic-and-the-one-thousand-jews-he-saved-from-nazi-horrors_337/index.html;Orchestra of Exiles: The Story of Bronislaw Huberman, the Israel Philharmonic, and the One Thousand Jews He Saved from Nazi Horrors;Music;3;12.36;True;4
/no-one-here-gets-out-alive_336/index.html;No One Here Gets Out Alive;Music;5;20.02;True;4
/night-shift-night-shift-1-20_335/index.html;Night Shift (Night Shift #1-20);Horror;4;12.75;True;4
/needful-things_334/index.html;Needful Things;Horror;4;47.51;True;4
/mockingjay-the-hunger-games-3_333/index.html;Mockingjay (The Hunger Games #3);Default;4;20.44;True;4
/misery_332/index.html;Misery;Horror;2;34.79;True;4
/little-women-little-women-1_331/index.html;Little Women (Little Women #1);Classics;4;28.07;True;4
/it_330/index.html;It;Horror;3;25.01;True;4
/harry-potter-and-the-sorcerers-stone-harry-potter-1_329/index.html;Harry Potter and the Sorcerer's Stone (Harry Potter #1);Default;3;13.90;True;4
/the-lean-startup-how-todays-entrepreneurs-use-continuous-innovation-to-create-radically-successful-businesses_260/index.html;The Lean Startup: How Today's Entrepreneurs Use Continuous Innovation to Create Radically Successful Businesses;Business;3;33.92;True;3
/isla-and-the-happily-ever-after-anna-and-the-french-kiss-3_380/index.html;Isla and the Happily Ever After (Anna and the French Kiss #3);Young Adult;5;48.13;True;5
/the-silkworm-cormoran-strike-2_280/index.html;The Silkworm (Cormoran Strike #2);Mystery;5;23.05;True;3
/the-dream-thieves-the-raven-cycle-2_400/index.html;The Dream Thieves (The Raven Cycle #2);Default;1;34.50;True;5
/harry-potter-and-the-prisoner-of-azkaban-harry-potter-3_328/index.html;Harry Potter and the Prisoner of Azkaban (Harry Potter #3);Young Adult;4;24.17;True;4
/if-i-stay-if-i-stay-1_379/index.html;If I Stay (If I Stay #1);Default;5;38.13;True;5
/the-last-painting-of-sara-de-vos_259/index.html;The Last Painting of Sara de Vos;Historical Fiction;2;55.55;True;3
/the-darkest-corners_399/index.html;The Darkest Corners;Young Adult;5;11.33;True;5
/the-sandman-vol-3-dream-country-the-sandman-volumes-3_279/index.html;The Sandman, Vol. 3: Dream Country (The Sandman (volumes) #3);Sequential Art;5;55.55;True;3
/harry-potter-and-the-order-of-the-phoenix-harry-potter-5_327/index.html;Harry Potter and the Order of the Phoenix (Harry Potter #5);Fantasy;4;31.63;True;4
/the-rose-the-dagger-the-wrath-and-the-dawn-2_278/index.html;The Rose & the Dagger (The Wrath and the Dawn #2);Fantasy;4;58.64;True;3
/i-know-why-the-caged-bird-sings-maya-angelous-autobiography-1_378/index.html;I Know Why the Caged Bird Sings (Maya Angelou's Autobiography #1);Default;2;36.55;True;5
/the-land-of-10000-madonnas_258/index.html;The Land of 10,000 Madonnas;Young Adult;4;29.64;True;3
/the-crossover_398/index.html;The Crossover;Poetry;4;38.77;True;5
/harry-potter-and-the-half-blood-prince-harry-potter-6_326/index.html;Harry Potter and the Half-Blood Prince (Harry Potter #6);Fantasy;5;48.75;True;4
/the-5th-wave-the-5th-wave-1_397/index.html;The 5th Wave (The 5th Wave #1);Default;2;11.83;True;5
/harry-potter-and-the-deathly-hallows-harry-potter-7_377/index.html;Harry Potter and the Deathly Hallows (Harry Potter #7);Default;1;23.32;True;5
/the-infinities_257/index.html;The Infinities;Fiction;1;27.41;True;3
/the-road-to-little-dribbling-adventures-of-an-american-in-britain-notes-from-a-small-island-2_277/index.html;The Road to Little Dribbling: Adventures of an American in Britain (Notes From a Small Island #2);Travel;1;23.21;True;3
/harry-potter-and-the-chamber-of-secrets-harry-potter-2_325/index.html;Harry Potter and the Chamber of Secrets (Harry Potter #2);Fantasy;1;14.74;True;4
/tell-the-wind-and-fire_396/index.html;Tell the Wind and Fire;Fantasy;3;45.51;True;5
/fruits-basket-vol-5-fruits-basket-5_376/index.html;Fruits Basket, Vol. 5 (Fruits Basket #5);Sequential Art;1;16.33;True;5
/the-husbands-secret_256/index.html;The Husband's Secret;Fiction;5;52.51;True;3
/the-rise-of-theodore-roosevelt-theodore-roosevelt-1_276/index.html;The Rise of Theodore Roosevelt (Theodore Roosevelt #1);Biography;3;42.57;True;3
/gone-with-the-wind_324/index.html;Gone with the Wind;Classics;3;32.49;True;4
/tell-me-three-things_395/index.html;Tell Me Three Things;Young Adult;1;41.81;True;5
/foundation-foundation-publication-order-1_375/index.html;Foundation (Foundation (Publication Order) #1);Science Fiction;1;32.42;True;5
/the-hitchhikers-guide-to-the-galaxy-hitchhikers-guide-to-the-galaxy-1_255/index.html;The Hitchhiker's Guide to the Galaxy (Hitchhiker's Guide to the Galaxy #1);Add a comment;3;47.80;True;3
/the-restaurant-at-the-end-of-the-universe-hitchhikers-guide-to-the-galaxy-2_275/index.html;The Restaurant at the End of the Universe (Hitchhiker's Guide to the Galaxy #2);Science Fiction;1;10.92;True;3
/god-is-not-great-how-religion-poisons-everything_323/index.html;God Is Not Great: How Religion Poisons Everything;Nonfiction;1;27.80;True;4
/talking-to-girls-about-duran-duran-one-young-mans-quest-for-true-love-and-a-cooler-haircut_394/index.html;Talking to Girls About Duran Duran: One Young Man's Quest for True Love and a Cooler Haircut;Nonfiction;4;25.15;True;5
/the-guns-of-august_254/index.html;The Guns of August;History;2;14.54;True;3
/the-rest-is-noise-listening-to-the-twentieth-century_274/index.html;The Rest Is Noise: Listening to the Twentieth Century;Add a comment;1;34.77;True;3
/girl-with-a-pearl-earring_322/index.html;Girl With a Pearl Earring;Historical Fiction;1;26.77;True;4
/fool-me-once_374/index.html;Fool Me Once;Default;1;16.96;True;5
/siddhartha_393/index.html;Siddhartha;Fiction;5;34.22;True;5
/the-red-tent_273/index.html;The Red Tent;Historical Fiction;5;35.66;True;3
/fruits-basket-vol-4-fruits-basket-4_321/index.html;Fruits Basket, Vol. 4 (Fruits Basket #4);Sequential Art;4;50.44;True;4
/find-her-detective-dd-warren-8_373/index.html;Find Her (Detective D.D. Warren #8);Add a comment;1;22.37;True;5
/the-guernsey-literary-and-potato-peel-pie-society_253/index.html;The Guernsey Literary and Potato Peel Pie Society;Historical Fiction;1;49.53;True;3
/shiver-the-wolves-of-mercy-falls-1_392/index.html;Shiver (The Wolves of Mercy Falls #1);Default;5;16.23;True;5
/the-purpose-driven-life-what-on-earth-am-i-here-for_272/index.html;The Purpose Driven Life: What on Earth Am I Here for?;Add a comment;3;37.19;True;3
/evicted-poverty-and-profit-in-the-american-city_372/index.html;Evicted: Poverty and Profit in the American City;Add a comment;1;42.27;True;5
/the-goldfinch_252/index.html;The Goldfinch;Default;3;43.58;True;3
/remember-me_391/index.html;Remember Me?;Default;3;11.48;True;5
/the-purest-hook-second-circle-tattoos-3_271/index.html;The Purest Hook (Second Circle Tattoos #3);Romance;1;12.25;True;3
/drama_371/index.html;Drama;Default;2;38.70;True;5
/the-giver-the-giver-quartet-1_251/index.html;The Giver (The Giver Quartet #1);Default;1;12.30;True;3
/red-dragon-hannibal-lecter-1_390/index.html;Red Dragon (Hannibal Lecter #1);Horror;3;23.37;True;5
/the-picture-of-dorian-gray_270/index.html;The Picture of Dorian Gray;Classics;2;29.70;True;3
/dracula-the-un-dead_370/index.html;Dracula the Un-Dead;Horror;5;35.63;True;5
/the-girl-with-all-the-gifts_250/index.html;The Girl with All the Gifts;Horror;3;49.47;True;3
/peak-secrets-from-the-new-science-of-expertise_389/index.html;Peak: Secrets from the New Science of Expertise;Science;2;16.28;True;5
/the-paris-wife_269/index.html;The Paris Wife;Default;3;36.80;True;3
/digital-fortress_369/index.html;Digital Fortress;Fiction;5;58.00;True;5
/my-mother-was-nuts_388/index.html;My Mother Was Nuts;Nonfiction;4;31.63;True;5
/the-girl-who-played-with-fire-millennium-trilogy-2_249/index.html;The Girl Who Played with Fire (Millennium Trilogy #2);Default;2;22.14;True;3
/the-obsession_268/index.html;The Obsession;Romance;1;45.43;True;3
/death-note-vol-5-whiteout-death-note-5_368/index.html;Death Note, Vol. 5: Whiteout (Death Note #5);Sequential Art;1;52.41;True;5
/mexican-today-new-and-rediscovered-recipes-for-contemporary-kitchens_387/index.html;Mexican Today: New and Rediscovered Recipes for Contemporary Kitchens;Food and Drink;5;24.91;True;5
/the-girl-who-kicked-the-hornets-nest-millennium-trilogy-3_248/index.html;The Girl Who Kicked the Hornet's Nest (Millennium Trilogy #3);Add a comment;1;57.48;True;3
/the-nightingale_267/index.html;The Nightingale;Fiction;4;26.26;True;3
/data-a-love-story-how-i-gamed-online-dating-to-meet-my-match_367/index.html;Data, A Love Story: How I Gamed Online Dating to Meet My Match;Nonfiction;3;32.35;True;5
/maybe-something-beautiful-how-art-transformed-a-neighborhood_386/index.html;Maybe Something Beautiful: How Art Transformed a Neighborhood;Childrens;1;22.54;True;5
/the-exiled_247/index.html;The Exiled;Mystery;3;43.45;True;3
/the-new-guy-and-other-senior-year-distractions_266/index.html;The New Guy (and Other Senior Year Distractions);Young Adult;3;44.92;True;3
/critique-of-pure-reason_366/index.html;Critique of Pure Reason;Philosophy;1;20.75;True;5
/lola-and-the-boy-next-door-anna-and-the-french-kiss-2_385/index.html;Lola and the Boy Next Door (Anna and the French Kiss #2);Young Adult;4;23.63;True;5
/the-end-of-faith-religion-terror-and-the-future-of-reason_246/index.html;The End of Faith: Religion, Terror, and the Future of Reason;Add a comment;4;22.13;True;3
/the-nanny-diaries-nanny-1_265/index.html;The Nanny Diaries (Nanny #1);Womens Fiction;5;52.53;True;3
/booked_365/index.html;Booked;Poetry;5;17.49;True;5
/the-elegant-universe-superstrings-hidden-dimensions-and-the-quest-for-the-ultimate-theory_245/index.html;The Elegant Universe: Superstrings, Hidden Dimensions, and the Quest for the Ultimate Theory;Science;4;13.03;True;3
/logan-kade-fallen-crest-high-55_384/index.html;Logan Kade (Fallen Crest High #5.5);Academic;2;13.12;True;5
/the-name-of-god-is-mercy_264/index.html;The Name of God is Mercy;Nonfiction;2;37.25;True;3
/blue-lily-lily-blue-the-raven-cycle-3_364/index.html;Blue Lily, Lily Blue (The Raven Cycle #3);Default;5;34.13;True;5
/the-disappearing-spoon-and-other-true-tales-of-madness-love-and-the-history-of-the-world-from-the-periodic-table-of-the-elements_244/index.html;The Disappearing Spoon: And Other True Tales of Madness, Love, and the History of the World from the Periodic Table of the Elements;Science;5;57.35;True;3
/last-one-home-new-beginnings-1_383/index.html;Last One Home (New Beginnings #1);Fiction;3;59.98;True;5
/the-maze-runner-the-maze-runner-1_263/index.html;The Maze Runner (The Maze Runner #1);Default;1;20.93;True;3
/approval-junkie-adventures-in-caring-too-much_363/index.html;Approval Junkie: Adventures in Caring Too Much;Autobiography;5;58.81;True;5
/the-devil-wears-prada-the-devil-wears-prada-1_243/index.html;The Devil Wears Prada (The Devil Wears Prada #1);Womens Fiction;1;44.29;True;3
/killing-floor-jack-reacher-1_382/index.html;Killing Floor (Jack Reacher #1);Thriller;4;31.49;True;5
/the-lovers-dictionary_262/index.html;The Lover's Dictionary;Default;2;58.09;True;3
/an-abundance-of-katherines_362/index.html;An Abundance of Katherines;Young Adult;5;10.00;True;5
/the-demon-haunted-world-science-as-a-candle-in-the-dark_242/index.html;The Demon-Haunted World: Science as a Candle in the Dark;Default;4;52.25;True;3
/kill-the-boy-band_381/index.html;Kill the Boy Band;Young Adult;5;15.52;True;5
/the-lonely-ones_261/index.html;The Lonely Ones;Childrens;5;43.59;True;3
/walk-the-edge-thunder-road-2_300/index.html;Walk the Edge (Thunder Road #2);Young Adult;3;32.36;True;3
/americas-war-for-the-greater-middle-east-a-military-history_361/index.html;America's War for the Greater Middle East: A Military History;History;2;51.22;True;5
/the-day-the-crayons-came-home-crayons_241/index.html;The Day the Crayons Came Home (Crayons);Childrens;5;26.33;True;3
/voyager-outlander-3_299/index.html;Voyager (Outlander #3);Historical Fiction;5;21.07;True;3
/very-good-lives-the-fringe-benefits-of-failure-and-the-importance-of-imagination_298/index.html;Very Good Lives: The Fringe Benefits of Failure and the Importance of Imagination;Nonfiction;3;50.66;True;3
/vegan-vegetarian-omnivore-dinner-for-everyone-at-the-table_297/index.html;Vegan Vegetarian Omnivore: Dinner for Everyone at the Table;Food and Drink;2;13.66;True;3
/unstuffed-decluttering-your-home-mind-and-soul_296/index.html;Unstuffed: Decluttering Your Home, Mind, and Soul;Nonfiction;1;58.09;True;3
/under-the-banner-of-heaven-a-story-of-violent-faith_295/index.html;Under the Banner of Heaven: A Story of Violent Faith;Nonfiction;1;30.00;True;3
/two-boys-kissing_294/index.html;Two Boys Kissing;Young Adult;2;32.74;True;3
/twilight-twilight-1_293/index.html;Twilight (Twilight #1);Default;2;41.93;True;3
/twenties-girl_292/index.html;Twenties Girl;Womens Fiction;2;42.80;True;3
/trespassing-across-america-one-mans-epic-never-done-before-and-sort-of-illegal-hike-across-the-heartland_291/index.html;Trespassing Across America: One Man's Epic, Never-Done-Before (and Sort of Illegal) Hike Across the Heartland;Nonfiction;1;53.51;True;3
/three-martini-lunch_290/index.html;Three-Martini Lunch;Fiction;3;23.21;True;3
/thinking-fast-and-slow_289/index.html;Thinking, Fast and Slow;Psychology;1;21.14;True;3
/jurassic-park-jurassic-park-1_180/index.html;Jurassic Park (Jurassic Park #1);Fiction;1;44.97;True;3
/the-da-vinci-code-robert-langdon-2_240/index.html;The Da Vinci Code (Robert Langdon #2);Fiction;2;22.96;True;3
/seven-days-in-the-art-world_220/index.html;Seven Days in the Art World;Add a comment;2;52.33;True;3
/girl-in-the-blue-coat_160/index.html;Girl in the Blue Coat;Historical Fiction;2;46.83;True;3
/the-wild-robot_288/index.html;The Wild Robot;Childrens;3;56.07;True;3
/its-never-too-late-to-begin-again-discovering-creativity-and-meaning-at-midlife-and-beyond_179/index.html;It's Never Too Late to Begin Again: Discovering Creativity and Meaning at Midlife and Beyond;Nonfiction;1;42.38;True;3
/seven-brief-lessons-on-physics_219/index.html;Seven Brief Lessons on Physics;Science;4;30.60;True;3
/the-cuckoos-calling-cormoran-strike-1_239/index.html;The Cuckoo's Calling (Cormoran Strike #1);Mystery;1;19.21;True;3
/fruits-basket-vol-3-fruits-basket-3_159/index.html;Fruits Basket, Vol. 3 (Fruits Basket #3);Sequential Art;2;45.17;True;3
/the-wicked-the-divine-vol-3-commercial-suicide-the-wicked-the-divine_287/index.html;The Wicked + The Divine, Vol. 3: Commercial Suicide (The Wicked + The Divine);Sequential Art;3;14.41;True;3
/scarlet-the-lunar-chronicles-2_218/index.html;Scarlet (The Lunar Chronicles #2);Young Adult;4;14.57;True;3
/is-everyone-hanging-out-without-me-and-other-concerns_178/index.html;Is Everyone Hanging Out Without Me? (And Other Concerns);Default;3;20.11;True;3
/the-complete-stories-and-poems-the-works-of-edgar-allan-poe-cameo-edition_238/index.html;The Complete Stories and Poems (The Works of Edgar Allan Poe [Cameo Edition]);Classics;4;26.78;True;3
/friday-night-lights-a-town-a-team-and-a-dream_158/index.html;Friday Night Lights: A Town, a Team, and a Dream;Sports and Games;3;51.22;True;3
/the-undomestic-goddess_286/index.html;The Undomestic Goddess;Womens Fiction;4;45.75;True;3
/fire-bound-sea-havensisters-of-the-heart-5_157/index.html;Fire Bound (Sea Haven/Sisters of the Heart #5);Add a comment;4;21.28;True;3
/sarahs-key_217/index.html;Sarah's Key;Add a comment;1;46.29;True;3
/the-complete-poems_237/index.html;The Complete Poems;Add a comment;5;41.32;True;3
/into-the-wild_177/index.html;Into the Wild;Nonfiction;5;56.70;True;3
/the-travelers_285/index.html;The Travelers;Thriller;1;15.77;True;3
/saga-volume-3-saga-collected-editions-3_216/index.html;Saga, Volume 3 (Saga (Collected Editions) #3);Sequential Art;5;21.57;True;3
/fifty-shades-freed-fifty-shades-3_156/index.html;Fifty Shades Freed (Fifty Shades #3);Adult Fiction;5;15.36;True;3
/the-catcher-in-the-rye_236/index.html;The Catcher in the Rye;Add a comment;1;24.55;True;3
/the-tipping-point-how-little-things-can-make-a-big-difference_284/index.html;The Tipping Point: How Little Things Can Make a Big Difference;Add a comment;2;10.02;True;3
/inferno-robert-langdon-4_176/index.html;Inferno (Robert Langdon #4);Fiction;5;41.00;True;3
/in-the-garden-of-beasts-love-terror-and-an-american-family-in-hitlers-berlin_175/index.html;In the Garden of Beasts: Love, Terror, and an American Family in Hitler's Berlin;Nonfiction;3;28.85;True;3
/fellside_155/index.html;Fellside;Default;1;38.62;True;3
/running-with-scissors_215/index.html;Running with Scissors;Autobiography;4;12.91;True;3
/the-cat-in-the-hat-beginner-books-b-1_235/index.html;The Cat in the Hat (Beginner Books B-1);Childrens;2;16.26;True;3
/the-thing-about-jellyfish_283/index.html;The Thing About Jellyfish;Childrens;1;48.77;True;3
/if-i-run-if-i-run-1_174/index.html;If I Run (If I Run #1);Christian Fiction;4;49.97;True;3
/extreme-prey-lucas-davenport-26_154/index.html;Extreme Prey (Lucas Davenport #26);Mystery;3;25.40;True;3
/the-case-for-christ-cases-for-christianity_234/index.html;The Case for Christ (Cases for Christianity);Add a comment;1;47.84;True;3
/rogue-lawyer-rogue-lawyer-1_214/index.html;Rogue Lawyer (Rogue Lawyer #1);Add a comment;3;50.11;True;3
/the-stand_282/index.html;The Stand;Horror;2;57.86;True;3
/ive-got-your-number_173/index.html;I've Got Your Number;Womens Fiction;1;19.69;True;3
/rise-of-the-rocket-girls-the-women-who-propelled-us-from-missiles-to-the-moon-to-mars_213/index.html;Rise of the Rocket Girls: The Women Who Propelled Us, from Missiles to the Moon to Mars;Nonfiction;4;41.67;True;3
/the-book-thief_233/index.html;The Book Thief;Default;2;53.49;True;3
/the-smitten-kitchen-cookbook_281/index.html;The Smitten Kitchen Cookbook;Food and Drink;1;23.59;True;3
/eragon-the-inheritance-cycle-1_153/index.html;Eragon (The Inheritance Cycle #1);Fantasy;3;43.87;True;3
/i-am-malala-the-girl-who-stood-up-for-education-and-was-shot-by-the-taliban_172/index.html;I Am Malala: The Girl Who Stood Up for Education and Was Shot by the Taliban;Nonfiction;2;28.88;True;3
/the-book-of-basketball-the-nba-according-to-the-sports-guy_232/index.html;The Book of Basketball: The NBA According to The Sports Guy;Sports and Games;5;44.84;True;3
/rework_212/index.html;Rework;Business;2;44.88;True;3
/eclipse-twilight-3_152/index.html;Eclipse (Twilight #3);Default;1;18.74;True;3
/the-blind-side-evolution-of-a-game_231/index.html;The Blind Side: Evolution of a Game;Add a comment;5;53.71;True;3
/hungry-girl-clean-hungry-easy-all-natural-recipes-for-healthy-eating-in-the-real-world_171/index.html;Hungry Girl Clean & Hungry: Easy All-Natural Recipes for Healthy Eating in the Real World;Food and Drink;3;33.14;True;3
/reservations-for-two_211/index.html;Reservations for Two;Romance;3;11.10;True;3
/dune-dune-1_151/index.html;Dune (Dune #1);Science Fiction;1;54.86;True;3
/civilization-and-its-discontents_140/index.html;Civilization and Its Discontents;Psychology;2;59.95;True;3
/dracula_150/index.html;Dracula;Default;3;52.62;True;3
/red-the-true-story-of-red-riding-hood_210/index.html;Red: The True Story of Red Riding Hood;Childrens;3;28.54;True;3
/the-autobiography-of-malcolm-x_230/index.html;The Autobiography of Malcolm X;Default;2;23.43;True;3
/house-of-lost-worlds-dinosaurs-dynasties-and-the-story-of-life-on-earth_170/index.html;House of Lost Worlds: Dinosaurs, Dynasties, and the Story of Life on Earth;History;2;43.70;True;3
/cinder-the-lunar-chronicles-1_139/index.html;Cinder (The Lunar Chronicles #1);Young Adult;1;26.09;True;3
/do-androids-dream-of-electric-sheep-blade-runner-1_149/index.html;Do Androids Dream of Electric Sheep? (Blade Runner #1);Science Fiction;1;51.48;True;3
/ready-player-one_209/index.html;Ready Player One;Science Fiction;4;19.07;True;3
/the-art-of-simple-food-notes-lessons-and-recipes-from-a-delicious-revolution_229/index.html;The Art of Simple Food: Notes, Lessons, and Recipes from a Delicious Revolution;Food and Drink;3;34.32;True;3
/house-of-leaves_169/index.html;House of Leaves;Horror;1;54.89;True;3
/catastrophic-happiness-finding-joy-in-childhoods-messy-years_138/index.html;Catastrophic Happiness: Finding Joy in Childhood's Messy Years;Parenting;2;37.35;True;3
/the-art-of-fielding_228/index.html;The Art of Fielding;Fiction;1;22.10;True;3
/horrible-bear_168/index.html;Horrible Bear!;Childrens;2;37.52;True;3
/disrupted-my-misadventure-in-the-start-up-bubble_148/index.html;Disrupted: My Misadventure in the Start-Up Bubble;Nonfiction;5;15.28;True;3
/quiet-the-power-of-introverts-in-a-world-that-cant-stop-talking_208/index.html;Quiet: The Power of Introverts in a World That Can't Stop Talking;Default;1;43.55;True;3
/career-of-evil-cormoran-strike-3_137/index.html;Career of Evil (Cormoran Strike #3);Mystery;2;24.72;True;3
/surely-youre-joking-mr-feynman-adventures-of-a-curious-character_227/index.html;Surely You're Joking, Mr. Feynman!: Adventures of a Curious Character;Science;2;25.83;True;3
/dead-wake-the-last-crossing-of-the-lusitania_147/index.html;Dead Wake: The Last Crossing of the Lusitania;Default;5;39.24;True;3
/breaking-dawn-twilight-4_136/index.html;Breaking Dawn (Twilight #4);Default;5;35.28;True;3
/prodigy-the-graphic-novel-legend-the-graphic-novel-2_207/index.html;Prodigy: The Graphic Novel (Legend: The Graphic Novel #2);Sequential Art;3;43.63;True;3
/holidays-on-ice_167/index.html;Holidays on Ice;Humor;2;51.07;True;3
/david-and-goliath-underdogs-misfits-and-the-art-of-battling-giants_146/index.html;David and Goliath: Underdogs, Misfits, and the Art of Battling Giants;Default;1;17.81;True;3
/heir-to-the-sky_166/index.html;Heir to the Sky;Fantasy;4;44.07;True;3
/stiff-the-curious-lives-of-human-cadavers_226/index.html;Stiff: The Curious Lives of Human Cadavers;Nonfiction;3;36.74;True;3
/brave-enough_135/index.html;Brave Enough;Nonfiction;5;51.32;True;3
/persepolis-the-story-of-a-childhood-persepolis-1-2_206/index.html;Persepolis: The Story of a Childhood (Persepolis #1-2);Sequential Art;1;39.13;True;3
/green-eggs-and-ham-beginner-books-b-16_165/index.html;Green Eggs and Ham (Beginner Books B-16);Childrens;4;10.79;True;3
/darkfever-fever-1_145/index.html;Darkfever (Fever #1);Fantasy;1;56.02;True;3
/spilled-milk-based-on-a-true-story_225/index.html;Spilled Milk: Based on a True Story;Nonfiction;1;49.51;True;3
/boy-meets-boy_134/index.html;Boy Meets Boy;Young Adult;3;21.12;True;3
/packing-for-mars-the-curious-science-of-life-in-the-void_205/index.html;Packing for Mars: The Curious Science of Life in the Void;Default;2;56.68;True;3
/grayson-vol-3-nemesis-grayson-3_164/index.html;Grayson, Vol 3: Nemesis (Grayson #3);Sequential Art;1;42.72;True;3
/outliers-the-story-of-success_204/index.html;Outliers: The Story of Success;Nonfiction;1;14.16;True;3
/dark-places_144/index.html;Dark Places;Default;5;23.90;True;3
/something-borrowed-darcy-rachel-1_224/index.html;Something Borrowed (Darcy & Rachel #1);Womens Fiction;5;48.96;True;3
/born-to-run-a-hidden-tribe-superathletes-and-the-greatest-race-the-world-has-never-seen_133/index.html;Born to Run: A Hidden Tribe, Superathletes, and the Greatest Race the World Has Never Seen;Nonfiction;2;27.35;True;3
/gratitude_163/index.html;Gratitude;Nonfiction;5;26.66;True;3
/original-fake_203/index.html;Original Fake;Sequential Art;3;31.45;True;3
/blink-the-power-of-thinking-without-thinking_132/index.html;Blink: The Power of Thinking Without Thinking;Nonfiction;5;21.74;True;3
